{
  "$schema": "https://json-schema.org/draft/2020-12/schema",
  "$id": "https://tool-call-compiler.dev/schemas/plan.schema.json",
  "title": "Tool Call Compiler Plan",
  "type": "object",
  "required": ["version", "tools", "nodes", "outputs"],
  "additionalProperties": false,
  "properties": {
    "version": { "const": "0" },
    "tools": {
      "type": "object",
      "additionalProperties": { "$ref": "#/$defs/toolSpec" }
    },
    "nodes": {
      "type": "array",
      "items": { "$ref": "#/$defs/node" }
    },
    "outputs": {
      "type": "object",
      "additionalProperties": { "type": "string" }
    }
  },
  "$defs": {
    "toolSpec": {
      "type": "object",
      "required": ["adapter"],
      "additionalProperties": false,
      "properties": {
        "adapter": { "type": "string", "minLength": 1 },
        "effects": { "$ref": "#/$defs/effects" },
        "limits": { "$ref": "#/$defs/limits" },
        "cost": { "$ref": "#/$defs/cost" }
      }
    },
    "effects": {
      "type": "object",
      "additionalProperties": false,
      "properties": {
        "pure": { "type": "boolean" },
        "reads": { "type": "array", "items": { "type": "string" } },
        "writes": { "type": "array", "items": { "type": "string" } },
        "idempotent": { "type": "boolean" },
        "cacheable": { "type": "boolean" },
        "batchable": { "type": "boolean" },
        "commutative": { "type": "boolean" },
        "timeout_ms": { "type": "integer", "minimum": 1 },
        "retry": { "$ref": "#/$defs/retry" }
      }
    },
    "limits": {
      "type": "object",
      "additionalProperties": false,
      "properties": {
        "max_concurrency": { "type": "integer", "minimum": 1 },
        "batch_size": { "type": "integer", "minimum": 1 }
      }
    },
    "cost": {
      "type": "object",
      "additionalProperties": false,
      "properties": {
        "fixed_ms": { "type": "integer", "minimum": 0 },
        "per_call_ms": { "type": "integer", "minimum": 0 },
        "tokens": { "type": "integer", "minimum": 0 }
      }
    },
    "retry": {
      "type": "object",
      "required": ["max_attempts"],
      "additionalProperties": false,
      "properties": {
        "max_attempts": { "type": "integer", "minimum": 1, "maximum": 255 },
        "retryable_errors": { "type": "array", "items": { "type": "string" } }
      }
    },
    "node": {
      "type": "object",
      "required": ["id", "tool"],
      "additionalProperties": false,
      "properties": {
        "id": { "type": "string", "minLength": 1 },
        "tool": { "type": "string", "minLength": 1 },
        "input": true,
        "depends_on": { "type": "array", "items": { "type": "string" } }
      }
    }
  }
}
