{
  "version": "0",
  "tools": {
    "const": {
      "adapter": "local",
      "effects": {
        "pure": true,
        "idempotent": true,
        "cacheable": true,
        "commutative": true
      }
    },
    "echo": {
      "adapter": "local",
      "effects": {
        "pure": true,
        "idempotent": true,
        "cacheable": true,
        "commutative": true
      }
    }
  },
  "nodes": [
    {
      "id": "user",
      "tool": "const",
      "input": {
        "value": {
          "id": "u_1",
          "name": "Ada"
        }
      }
    },
    {
      "id": "message",
      "tool": "echo",
      "input": {
        "user_id": {
          "$ref": "user.output.id"
        },
        "name": {
          "$ref": "user.output.name"
        }
      }
    }
  ],
  "outputs": {
    "message": "message.output"
  }
}
