{
  "version": "0",
  "tools": {
    "write": {
      "adapter": "local",
      "effects": {
        "writes": ["db:user"],
        "idempotent": false,
        "cacheable": false
      }
    }
  },
  "nodes": [
    {
      "id": "write_a",
      "tool": "write",
      "input": {
        "id": "u_1",
        "name": "Ada"
      }
    },
    {
      "id": "write_b",
      "tool": "write",
      "input": {
        "id": "u_1",
        "name": "Grace"
      }
    }
  ],
  "outputs": {
    "last": "write_b.output"
  }
}
